{
  "$schema": "http://json-schema.org/draft-07/schema#",
  "title": "Clarity Engine Raw Intent Packet",
  "description": "Schema for provenance-preserving human intent captured before grounding into a PCP-lite Mission Packet.",
  "type": "object",
  "additionalProperties": false,
  "required": [
    "version",
    "raw_intent",
    "status",
    "provenance"
  ],
  "properties": {
    "version": {
      "type": "string",
      "enum": [
        "1.0.0"
      ]
    },
    "raw_intent": {
      "type": "string",
      "minLength": 1,
      "description": "Original human entry preserved verbatim."
    },
    "status": {
      "type": "string",
      "enum": [
        "captured",
        "grounding",
        "clarification_needed",
        "ready_for_mission",
        "promoted",
        "abandoned"
      ]
    },
    "provenance": {
      "type": "object",
      "additionalProperties": false,
      "required": [
        "source"
      ],
      "properties": {
        "source": {
          "type": "string",
          "enum": [
            "ui",
            "api",
            "cli",
            "mcp",
            "import"
          ]
        },
        "author": {
          "type": "string",
          "minLength": 1
        },
        "captured_at": {
          "type": "string",
          "format": "date-time"
        }
      }
    },
    "human_context": {
      "$ref": "#/definitions/nonEmptyStringArray"
    },
    "constraints": {
      "$ref": "#/definitions/nonEmptyStringArray"
    },
    "desired_direction": {
      "type": "string",
      "minLength": 1
    },
    "assumptions": {
      "$ref": "#/definitions/nonEmptyStringArray"
    },
    "related_projects": {
      "$ref": "#/definitions/nonEmptyStringArray"
    },
    "clarifications_needed": {
      "$ref": "#/definitions/nonEmptyStringArray"
    },
    "context_sources": {
      "$ref": "#/definitions/nonEmptyStringArray"
    },
    "verified_facts": {
      "$ref": "#/definitions/nonEmptyStringArray"
    },
    "grounding_observations": {
      "$ref": "#/definitions/nonEmptyStringArray"
    },
    "rejected_assumptions": {
      "$ref": "#/definitions/nonEmptyStringArray"
    },
    "clarification_answers": {
      "$ref": "#/definitions/nonEmptyStringArray"
    },
    "unresolved_gaps": {
      "$ref": "#/definitions/nonEmptyStringArray"
    },
    "grounding_entries": {
      "type": "array",
      "items": {
        "$ref": "#/definitions/groundingEntry"
      },
      "minItems": 1
    },
    "clarifications": {
      "type": "array",
      "items": {
        "$ref": "#/definitions/clarificationEntry"
      },
      "minItems": 1
    },
    "parent_intent_sha": {
      "type": "string",
      "pattern": "^[a-f0-9]{64}$"
    }
  },
  "definitions": {
    "nonEmptyStringArray": {
      "type": "array",
      "items": {
        "type": "string",
        "minLength": 1
      },
      "minItems": 1
    },
    "groundingEntry": {
      "type": "object",
      "additionalProperties": false,
      "required": [
        "kind",
        "statement",
        "sources"
      ],
      "properties": {
        "kind": {
          "type": "string",
          "enum": [
            "observation",
            "verified_fact",
            "rejected_assumption"
          ]
        },
        "statement": {
          "type": "string",
          "minLength": 1
        },
        "sources": {
          "$ref": "#/definitions/nonEmptyStringArray"
        }
      }
    },
    "clarificationEntry": {
      "type": "object",
      "additionalProperties": false,
      "required": [
        "id",
        "question",
        "status"
      ],
      "properties": {
        "id": {
          "type": "string",
          "pattern": "^[a-z0-9][a-z0-9._-]{0,63}$"
        },
        "question": {
          "type": "string",
          "minLength": 1
        },
        "status": {
          "type": "string",
          "enum": [
            "open",
            "answered"
          ]
        },
        "answer": {
          "type": "string",
          "minLength": 1
        }
      }
    }
  }
}
